{
  "$schema": "https://json-schema.org/draft/2020-12/schema",
  "$id": "https://ojfbot.dev/core/scripts/launcher/schema/registration.schema.json",
  "title": "Sub-app registration",
  "description": "Per-rig registration consumed by core/scripts/launcher/scripts/launch.sh. See ADR-0058 (decisions/adr/0058-sub-app-registration-schema.md).",
  "type": "object",
  "required": ["schema_version", "id", "display_name", "repo", "priority_tier", "panes"],
  "additionalProperties": false,
  "properties": {
    "schema_version": {
      "const": "1.0.0",
      "description": "Pinned. Schema-breaking changes require a new ADR and version bump."
    },
    "id": {
      "type": "string",
      "pattern": "^[a-z][a-z0-9-]{0,31}$",
      "description": "Kebab-case rig identifier. Used in tmux window names. May or may not equal the rig's BEAD_PREFIX_MAP key — see bead_prefix."
    },
    "bead_prefix": {
      "type": "string",
      "pattern": "^[a-z][a-z0-9]{0,15}$",
      "description": "Optional. Bead prefix for AgentBead routing (e.g. 'gt' for gastown-pilot, 'cv' for cv-builder). Defaults to id when omitted. Must match a key in BEAD_PREFIX_MAP at core/packages/workflows/src/types/bead.ts:95-105 or an ADR-0052 reservation."
    },
    "display_name": {
      "type": "string",
      "minLength": 1
    },
    "repo": {
      "type": "object",
      "required": ["local_path"],
      "additionalProperties": false,
      "properties": {
        "url": { "type": "string", "format": "uri" },
        "local_path": {
          "type": "string",
          "description": "Absolute path to the rig's local checkout. Validator confirms the directory exists at launch time."
        },
        "branch": { "type": "string", "default": "main" }
      }
    },
    "priority_tier": {
      "enum": ["infrastructure", "active", "dormant"],
      "description": "Drives default visual status (ADR-0059) and launch order. infrastructure starts grey; active starts cyan; dormant registers but does not launch unless --include-dormant."
    },
    "rig_profile": {
      "enum": ["frame", "non-frame"],
      "description": "Per ADR-0051. frame rigs follow Frame conventions (MF, Carbon, frame-agent). non-frame rigs deliberately diverge."
    },
    "order": {
      "type": "integer",
      "minimum": 0,
      "default": 100,
      "description": "Sort within tmux window list. Lower numbers come first."
    },
    "tags": {
      "type": "array",
      "items": { "type": "string" }
    },
    "panes": {
      "type": "array",
      "minItems": 1,
      "maxItems": 4,
      "items": { "$ref": "#/$defs/pane" }
    },
    "claude_sessions": {
      "type": "object",
      "additionalProperties": false,
      "properties": {
        "headless": {
          "type": "object",
          "additionalProperties": false,
          "properties": {
            "enabled": { "type": "boolean", "default": true },
            "role": { "enum": ["worker", "witness", "mayor"], "default": "worker" }
          }
        },
        "interactive": {
          "type": "object",
          "additionalProperties": false,
          "properties": {
            "key_binding": {
              "type": "string",
              "description": "Optional. tmux prefix-key chord to attach an interactive Claude session in a new pane."
            }
          }
        }
      }
    },
    "pre_launch": {
      "type": "string",
      "description": "Optional shell command run once before any panes start. Use for one-shot setup; do not use for long-running processes."
    }
  },
  "$defs": {
    "pane": {
      "type": "object",
      "required": ["name", "command"],
      "additionalProperties": false,
      "properties": {
        "name": {
          "type": "string",
          "pattern": "^[a-z][a-z0-9-]{0,15}$"
        },
        "command": {
          "type": "string",
          "minLength": 1
        },
        "size": {
          "type": "string",
          "pattern": "^([0-9]{1,2}|100)%$",
          "description": "Percentage of the parent split. Sums of sibling sizes should approach 100%."
        },
        "split": {
          "enum": ["horizontal", "vertical"],
          "description": "How this pane splits relative to the previous pane. Ignored for the first pane."
        },
        "ready_signal": {
          "type": "object",
          "additionalProperties": false,
          "required": ["type", "pattern"],
          "properties": {
            "type": { "const": "stdout_match" },
            "pattern": { "type": "string", "minLength": 1 },
            "timeout_seconds": {
              "type": "integer",
              "minimum": 1,
              "default": 60
            }
          }
        }
      }
    }
  }
}
