{
  "schema_version": "1.0.0",
  "id": "core-reader",
  "display_name": "core-reader (Frame sub-app)",
  "repo": {
    "url": "https://github.com/ojfbot/core-reader",
    "local_path": "${HOME}/ojfbot/core-reader",
    "branch": "main"
  },
  "priority_tier": "dormant",
  "rig_profile": "frame",
  "order": 40,
  "tags": ["frontend", "MF-remote"],
  "panes": [
    {
      "name": "dev",
      "command": "pnpm dev",
      "size": "70%"
    },
    {
      "name": "claude-headless",
      "command": "node ${HOME}/ojfbot/core/scripts/hooks/bead-emit.mjs agent-create --role=worker --app=core-reader --session-id=launcher && echo '✓ core-reader-agent-worker registered' && tail -f /dev/null",
      "size": "30%",
      "split": "horizontal"
    }
  ],
  "claude_sessions": {
    "headless": { "enabled": true, "role": "worker" },
    "interactive": { "key_binding": "M-5" }
  }
}
